{
  "$schema": "http://json-schema.org/draft-07/schema#",
  "title": "SapGtsMaterial",
  "type": "object",
  "required": ["schemaVersion", "eventType", "eventId", "data"],
  "properties": {
    "schemaVersion": { "type": "string" },
    "eventType": { "type": "string" },
    "eventId": { "type": "string" },
    "eventTimestamp": { "type": "string" },
    "data": {
      "type": "object",
      "required": ["materialNumber"],
      "properties": {
        "materialNumber": { "type": "string" }
      }
    }
  }
}